{
  "eventId": "evt_01HSZ5H7N97M5J77EZBM4VJYMR",
  "schemaVersion": "rawcraft.history-event/v1",
  "documentId": "edit_01HSZ4W0AQV3M7A0YQY7EJQ2AB",
  "sequence": 124,
  "parentRevisionId": "rev_000123",
  "resultRevisionId": "rev_000124",
  "timestamp": "2026-04-05T09:51:30Z",
  "actor": {
    "id": "copilot",
    "type": "ai",
    "displayName": "RawCraft Copilot"
  },
  "source": {
    "kind": "ai_run",
    "clientId": "desktop-app",
    "sessionId": "session_01HSZ5A0WMP9W0DF1FET6A8ZQB",
    "runId": "run_01HSZ57CN5D7AER3Y2GG5Z5B6J",
    "model": "gpt-5.4"
  },
  "intent": {
    "kind": "accept_ai_suggestion",
    "summary": "Accepted AI relight proposal for the detected subject",
    "promptDigest": "sha256:5a3a2d4f",
    "correlationId": "suggestion_01HSZ58BMTN6N4Y3CP4D9V4V6E"
  },
  "ops": [
    {
      "type": "adjustment.insert",
      "index": 1,
      "entry": {
        "id": "adj_subject_mask_01",
        "tool": "subject_light",
        "stage": "local",
        "enabled": true,
        "scope": {
          "target": "mask",
          "maskId": "mask_subject_01"
        },
        "params": {
          "exposure": 0.2,
          "shadows": 18
        },
        "paramSchemaVersion": 1,
        "blend": {
          "mode": "normal",
          "opacity": 0.85
        },
        "provenance": {
          "actorType": "ai",
          "actorId": "copilot",
          "sourceKind": "ai_run",
          "runId": "run_01HSZ57CN5D7AER3Y2GG5Z5B6J",
          "model": "gpt-5.4",
          "promptDigest": "sha256:5a3a2d4f",
          "summary": "Accepted AI relight suggestion"
        },
        "createdAt": "2026-04-05T09:51:30Z",
        "updatedAt": "2026-04-05T09:51:30Z"
      }
    },
    {
      "type": "document.set_metadata",
      "metadata": {
        "renderLineage": {
          "previewSource": {
            "tier": "edit_preview",
            "sourceAssetRevisionId": "asset_rev_0001",
            "sourceRevisionId": "rev_000124",
            "generatedAt": "2026-04-05T09:51:30Z"
          },
          "cacheLineage": {
            "previewCacheVersion": "preview-cache/v3",
            "renderCacheVersion": "render-cache/v5",
            "invalidatesAfterSequence": 124
          },
          "inputProfiles": {
            "cameraProfileId": "canon/eos-r6m2/adobe-standard",
            "inputIccProfileId": "icc/adobe-rgb-1998",
            "workingColorSpaceId": "color/linear-prophoto-rgb"
          },
          "sidecarLink": {
            "xmpAssetId": "sidecar_01HSZ4Z5W6VMPA9Y44Q6ZB7M1C",
            "xmpAssetRevisionId": "sidecar_rev_0003",
            "xmpDigest": "sha256:2e9b2c6b"
          }
        }
      }
    }
  ],
  "integrity": {
    "stackHashBefore": "sha256:91e3a2df",
    "stackHashAfter": "sha256:b3d91d7a"
  }
}
